{
  "$schema": "../../schemas/catalog.schema.json",
  "version": "1.0.0",
  "category": "catalogs",
  "title": "Rule Catalog",
  "description": "Auto-generated catalog of all system rules",
  "metadata": {
    "generated": "2026-02-18"
  },
  "content": {
    "rules": [
      {
        "id": "agent-definition",
        "name": "Agent Definition",
        "description": "No description provided",
        "location": ".agent/rules/agent-definition.md"
      },
      {
        "id": "creator-skills-protocol",
        "name": "Creator Skills Protocol",
        "description": "No description provided",
        "location": ".agent/rules/creator-skills-protocol.md"
      },
      {
        "id": "git-governance",
        "name": "Git Governance",
        "description": "No description provided",
        "location": ".agent/rules/git-governance.md"
      },
      {
        "id": "knowledge-management",
        "name": "Knowledge Management",
        "description": "No description provided",
        "location": ".agent/rules/knowledge-management.md"
      },
      {
        "id": "mcp-management",
        "name": "Mcp Management",
        "description": "No description provided",
        "location": ".agent/rules/mcp-management.md"
      },
      {
        "id": "memory-management-protocol",
        "name": "Memory Management Protocol",
        "description": "No description provided",
        "location": ".agent/rules/memory-management-protocol.md"
      },
      {
        "id": "operating-model",
        "name": "Operating Model",
        "description": "No description provided",
        "location": ".agent/rules/operating-model.md"
      },
      {
        "id": "plane-task-governance",
        "name": "Plane Task Governance",
        "description": "Central governance rules for creating and managing Plane PMS tasks.",
        "location": ".agent/rules/plane-task-governance.md"
      },
      {
        "id": "script-change-protocol",
        "name": "Script Change Protocol",
        "description": "No description provided",
        "location": ".agent/rules/script-change-protocol.md"
      },
      {
        "id": "skill-development",
        "name": "Skill Development",
        "description": "No description provided",
        "location": ".agent/rules/skill-development.md"
      },
      {
        "id": "system-organization",
        "name": "System Organization",
        "description": "No description provided",
        "location": ".agent/rules/system-organization.md"
      },
      {
        "id": "technical-standards",
        "name": "Technical Standards",
        "description": "No description provided",
        "location": ".agent/rules/technical-standards.md"
      },
      {
        "id": "temporary-file-governance",
        "name": "Temporary File Governance",
        "description": "No description provided",
        "location": ".agent/rules/temporary-file-governance.md"
      },
      {
        "id": "trading-governance",
        "name": "Trading Governance",
        "description": "No description provided",
        "location": ".agent/rules/trading-governance.md"
      },
      {
        "id": "workflow-execution",
        "name": "Workflow Execution",
        "description": "No description provided",
        "location": ".agent/rules/workflow-execution.md"
      },
      {
        "id": "workflow-standard",
        "name": "Workflow Standard",
        "description": "No description provided",
        "location": ".agent/rules/workflow-standard.md"
      }
    ]
  }
}
